Inference,Description,score,short rationale
Soil moisture rising during rain detections while water usage drops indicates effective rainfall replacement,"Natural rainfall is sufficient to maintain or increase soil moisture, allowing irrigation to decrease.",2,"Operational insight on rainfall replacing irrigation; minimal privacy risk."
Soil moisture falling during rain detections despite water usage reduction indicates insufficient rainfall intensity,Rain is detected but does not provide enough water to prevent soil moisture decline.,2,"Shows weak rain events affecting irrigation planning."
Soil moisture rising significantly during rain detections and low water usage indicates strong storm or heavy precipitation,Large moisture increases show rainfall alone is responsible for hydration.,2,"Identifies heavy rain impact; low sensitivity."
Soil moisture unchanged during rain detections and low water usage suggests canopy interception or rainfall not reaching the soil,Water is detected by sensors but does not infiltrate the soil effectively.,2,"Points to infiltration barriers; operational context only."
Soil moisture falling during long rain-detection gaps and increasing water usage indicates drought response,Lack of rainfall forces irrigation to compensate for declining moisture.,3,"Shows drought adaptation and irrigation load; moderate operational sensitivity."
Soil moisture rising during periods of minimal water usage and frequent rain detections confirms rainy-season dominance,Rainfall fully meets hydration needs without irrigation.,2,"Indicates seasonality of rain vs irrigation; low privacy impact."
Soil moisture falling despite high water usage and no rain detections indicates severe dryness or rapid evapotranspiration,Environmental demand exceeds both rainfall and irrigation contributions.,3,"Highlights severe dryness driving high use; moderate operational signal."
Soil moisture rising during high water usage and no rain detections suggests irrigation is effectively hydrating the soil,Increased water usage compensates for lack of rainfall and improves moisture.,2,"Shows irrigation efficacy; minimal privacy risk."
Soil moisture stable during fluctuating water usage and intermittent rain detections indicates strong soil buffering capacity,Soil retains water well despite variable input from irrigation and rainfall.,2,"Indicates soil buffering; low sensitivity."
Water usage dropping sharply during rain detections with soil moisture rising confirms correct system responsiveness,The system is properly stopping irrigation once rain provides sufficient hydration.,2,"Confirms control responsiveness; low privacy impact."
Water usage remaining high during rain detections with soil moisture rising rapidly suggests overlapping irrigation and rainfall,Irrigation may be mistimed or unable to respond quickly to rainfall events.,2,"Shows overlap of irrigation and rain; modest operational detail."
Water usage remaining high during rain detections with soil moisture falling indicates irrigation inefficiency or misconfiguration,Even combined rainfall and irrigation fail to improve moisture.,3,"Signals misconfigured irrigation under rain; moderate operational sensitivity."
Soil moisture rising only slightly during rain detections and high water usage indicates shallow rainfall penetration,Rain does not infiltrate deeply and irrigation adds only modest moisture.,2,"Suggests shallow rainfall; low privacy risk."
Soil moisture rising steeply during rain detections regardless of water usage indicates rainfall-driven hydration dominance,Irrigation becomes secondary because rain provides most soil water.,2,"Rain-dominant hydration insight; minimal sensitivity."
Periods of zero water usage with soil moisture still rising during rain detections indicate irrigation fully suspended due to rainfall,"Rain alone hydrates the soil, preventing irrigation cycles.",1,"Shows automatic suspension; very low sensitivity."
Periods of high water usage during rain-detection gaps with soil moisture still falling indicate rapid water loss from soil,Evaporation or deep percolation removes water quickly even during heavy irrigation.,3,"Highlights rapid loss despite irrigation; moderate operational impact."
Soil moisture consistently high during alternating rain detections and low water usage indicates sustained wet-season saturation,Rain events keep soil moisture elevated without irrigation support.,2,"Wet-season saturation signal; low privacy concern."
Soil moisture consistently low during alternating rain detections and high water usage indicates rainfall ineffectiveness,Rain is detected but not strong or frequent enough to penetrate the soil.,2,"Shows ineffective rain; modest operational context."
Water usage spikes after rain-detection periods with falling soil moisture indicate recovery irrigation after minor rainfall,"Rainfall was not strong enough, prompting irrigation boosts once rain stops.",2,"Recovery irrigation behavior; low sensitivity."
"Water usage remains low after rain detections and soil moisture stays high, indicating prolonged post-rain soil saturation","The soil remains wet long after the rain stops, reducing irrigation needs.",1,"Indicates sustained saturation; very low sensitivity."
Soil moisture falling before rain detections and rising during rainfall with reduced water usage indicates accurate weather synchronization,Rainfall timing aligns perfectly with soil moisture behavior and irrigation reduction.,2,"Shows good synchronization; minimal privacy risk."
Soil moisture falling before rain detections and continuing to fall during rainfall with low water usage indicates insufficient stormwater absorption,Rainfall does not provide meaningful soil moisture improvement.,2,"Highlights poor absorption; low sensitivity."
Soil moisture rising after rain detections even with zero water usage indicates delayed rainfall infiltration,"Water takes time to percolate downward, increasing moisture after rain ends.",2,"Shows delayed infiltration; minimal privacy concern."
Soil moisture falling after rain detections even with rising water usage indicates deep moisture deficit,Irrigation and rain cannot replenish deeper soil layers immediately.,3,"Reveals deep deficits driving high use; moderate operational sensitivity."
Stable soil moisture during frequent rain detections and low water usage indicates soil saturation equilibrium,Moisture has reached a point where additional rainfall cannot increase it further.,2,"Shows saturation equilibrium; low sensitivity."
Stable soil moisture during rare rain detections and low water usage indicates minimal environmental water demand,Soil loses moisture slowly regardless of rainfall or irrigation.,1,"Indicates low demand; very low privacy impact."
Water usage rising during rain-detection gaps with soil moisture rising too indicates irrigation oversupply,"Moisture increases even without rain, suggesting irrigation volumes may be too high.",2,"Points to possible overwatering; low sensitivity."
Water usage rising during rain-detection gaps but soil moisture falling indicates strong environmental drying forces,Evaporation or soil characteristics prevent moisture retention even with irrigation.,3,"Shows strong drying despite irrigation; moderate operational exposure."
Water usage dropping during rain detections but soil moisture falling indicates inadequate rainfall volume,"The system stops watering due to rain signals, but rainfall does not sufficiently hydrate the soil.",2,"Indicates rainfall insufficiency under shutoff; modest sensitivity."
