"Inference","Description","score","short rationale"
"Soil moisture rising during rain detections, low water usage, low temperatures, and high humidity indicates strong natural hydration without irrigation","Cool, moist conditions maximize rainfall absorption, reducing the need for irrigation.",1,"Rain-driven hydration; very low sensitivity."
"Soil moisture rising during rain detections even with high temperatures and low humidity indicates heavy rainfall overcoming evaporative drying","Large rainfall volume compensates for conditions that normally cause rapid water loss.",2,"Heavy rain overcoming drying; low privacy risk."
"Soil moisture falling during rain detections, high temperatures, and high water usage indicates irrigation and rainfall both failing to offset evaporation","Extreme heat prevents meaningful moisture retention even during watering and rainfall.",3,"Severe drying despite rain and irrigation."
"Soil moisture falling despite rain detections, low water usage, cool temperatures, and high humidity indicates soil infiltration failure or hydrophobicity","Environmental conditions favor moisture gain, but soil structure prevents water absorption.",3,"Infiltration failure under ideal weather."
"Soil moisture rising during no rain detections, low temperatures, high humidity, and low water usage reflects dew-driven or fog-driven hydration","Atmospheric condensation increases soil moisture without rainfall or irrigation.",1,"Dew/fog hydration; minimal sensitivity."
"Soil moisture falling during no rain detections, high temperatures, low humidity, and high water usage indicates maximum evaporative stress","Environmental drying forces overwhelm irrigation capacity.",3,"Maximum stress overriding irrigation."
"Soil moisture stable during no rain detections, moderate temperatures, high humidity, and low water usage indicates self-maintaining soil moisture balance","Soil retains water under mild environmental conditions.",1,"Self-maintaining balance; very low sensitivity."
"Soil moisture rising during high water usage, moderate temperatures, moderate humidity, and no rain detections indicates effective irrigation during dry periods","Irrigation alone produces significant moisture gains.",2,"Irrigation effective in dry spell; low sensitivity."
"Soil moisture falling during high water usage, low humidity, rising temperatures, and no rain detections indicates insufficient irrigation scaling","Watering is not keeping up with atmospheric drying.",3,"Insufficient scaling under drying conditions."
"Soil moisture rising sharply during heavy rain detections despite low water usage, high temperatures, and falling humidity indicates rainfall dominance","Intense rainfall provides enough water to overcome drying effects.",2,"Rain dominates despite drying; low risk."
"Soil moisture stable despite high water usage, moderate rain detections, and fluctuating temperatures indicates buffered or saturated soil","The soil may already be near its water-holding capacity.",1,"Buffered/saturated soil; very low sensitivity."
"Soil moisture falling sharply during high water usage, no rain detections, high temperatures, and low humidity signals severe drought","Environmental conditions are extreme enough to prevent moisture gains even with heavy irrigation.",3,"Severe drought despite heavy watering."
"Soil moisture rising slowly during low water usage, mild rain detections, cool temperatures, and high humidity indicates weak rainfall with gradual infiltration","Moisture enters slowly under gentle rain events and favorable environmental conditions.",2,"Gentle rain gradual gain; low sensitivity."
"Soil moisture falling despite cool temperatures, high humidity, and high water usage with no rain detections suggests deep soil dryness","Moisture does not accumulate due to deep water deficits requiring long-term replenishment.",3,"Deep deficits despite heavy inputs."
"Soil moisture rising during intermittent rain detections, moderate temperatures, high humidity, and minimal water usage indicates efficient rainfall absorption during transitional weather","Environmental conditions amplify rainfall effectiveness.",1,"Efficient rain absorption; very low sensitivity."
"Soil moisture falling during periods without rain, with low humidity, high temperatures, and decreasing water usage indicates incorrect irrigation reduction","The system is reducing water even as conditions require more irrigation.",3,"Under-watering while conditions worsen."
"Soil moisture rising during periods without rain, with moderate humidity, moderate temperatures, and low water usage could indicate underground water movement or oversaturated deeper layers","Moisture moves upward or persists even with minimal irrigation contribution.",2,"Upward moisture movement; low sensitivity."
"Soil moisture falling slightly during rain detections, rising temperatures, and low water usage indicates evaporative loss from warm rainstorms","Warm rainfall may evaporate quickly before it replenishes soil moisture.",2,"Warm-rain evaporation causing loss; low sensitivity."
"Soil moisture rising significantly during nights with rain detections, low temperatures, and high humidity indicates optimal rainfall absorption cycles","Night conditions reduce evaporation and improve infiltration.",1,"Optimal night absorption; minimal sensitivity."
"Soil moisture falling significantly during days with no rain detections, rising temperatures, and high water usage indicates diurnal drying overpowering irrigation","Daytime heat drastically increases evaporation, diminishing irrigation effectiveness.",3,"Daytime drying overwhelms irrigation."
