Inference,Description,score,short rationale
Rain detections occurring during low humidity indicate the onset of sudden rainfall events,Low humidity followed by rain detection suggests abrupt storm fronts where rain rapidly increases atmospheric moisture.,1,"Abrupt rain in dry air; weather-only, no personal detail."
Rain detections occurring during high humidity indicate saturated atmospheric conditions,"High humidity often precedes rainfall, so detection during these periods reflects moisture-rich air transitioning into rain.",1,Moist air transitioning to rain; climate signal only.
Rain detections during temperature drops indicate cold-front rainfall,"Rainfall commonly cools the surrounding air, making temperature drops a typical precursor or response to rain events.",1,Cooling rain front; environmental pattern only.
Rain detections during temperature spikes indicate warm-season rainfall or convective storms,Rain during hot conditions suggests summer storms or rapid moisture buildup resulting in sudden precipitation.,1,Hot-season/convective rain clue; weather only.
Humidity rising sharply before rain detection indicates atmospheric condensation buildup,"Humidity increases as the air nears saturation, often moments before rainfall begins.",1,Pre-rain saturation cue; no behavioral data.
Humidity remaining low during rain detection suggests light or wind-driven rainfall,"If humidity does not rise with rain, raindrops may evaporate quickly or rain may be sparse and wind-carried.",1,Light/windblown rain; environmental only.
Temperature dropping sharply after rain detection indicates cooling caused by precipitation,Rain reduces air temperature through evaporative cooling and cloud cover.,1,Post-rain cooling effect; weather signal only.
Temperature remaining stable during rain detection suggests mild or low-intensity rainfall,Light rain may not significantly influence ambient temperature.,1,Mild rain with minimal thermal change; environmental only.
Humidity rising slowly after rain detection indicates gradual atmospheric saturation,Light but sustained rainfall gradually increases humidity levels rather than sudden spikes.,1,Gradual saturation from light rain; climate-only signal.
Humidity spiking immediately after rain detection indicates heavy or high-intensity rainfall,"Strong rain rapidly increases atmospheric moisture, causing abrupt humidity jumps.",1,Heavy rain spikes humidity; weather signal only.
Rain detections during high temperature and low humidity suggest sudden storm formation under dry heat,"These conditions typically reflect rapid convective rain events in hot, arid periods.",1,"Hot, dry convective rain; environmental only."
Rain detections during high temperature and high humidity indicate tropical rainfall patterns,"Warm, moisture-saturated air commonly produces heavy tropical rain.",2,Tropical-like rain pattern hints regional climate; minor contextual exposure.
Rain detections during low temperature and high humidity indicate cold-season rainfall or drizzle,"These conditions are typical of wet, cool climates where moisture collects without heat-driven storms.",2,Cool-season drizzle pattern hints wet/cool locale; minor context.
Temperature fluctuations strongly aligned with rain detections indicate responsive atmospheric dynamics,Rain-associated cooling or heating patterns show the environment reacts predictably to precipitation events.,1,Atmosphere reacts predictably to rain; weather-only insight.
Humidity fluctuations strongly aligned with rain detections indicate high sensitivity to precipitation levels,Humidity shifts before and after rain reflect the atmosphere’s reaction to incoming or departing moisture.,1,Humidity tracks rain events; environmental response only.
High humidity without rain detections suggests near-rain conditions or fog formation,"Moisture saturation may occur without rainfall, indicating possible dew, mist, or fog.",1,"Near-rain/fog signal; climate-only, no personal data."
Low humidity with rain detections suggests sparse rainfall or rapid evaporation,"Rain may evaporate quickly in dry air, preventing significant humidity rise.",1,Sparse/evaporating rain; environmental only.
Temperature drops that occur before rain detections suggest pre-rain cooling winds or cloud cover,Environmental cooling sometimes precedes rainfall due to shading and outflow winds.,1,Pre-rain cooling from clouds/outflow; weather only.
Temperature rises after rain detections suggest post-rain warming or clearing skies,"Sun exposure returns after rainfall, increasing temperature.",1,Post-rain warming/clearing; environmental signal only.
"Humidity remains high long after rain detection events, indicating prolonged wet atmospheric conditions",Rainfall contributes to sustained atmospheric moisture even after precipitation stops.,1,Lingering atmospheric moisture; climate-only insight.
Humidity returning quickly to low levels after rain detections indicates rapid atmospheric drying,Wind or heat dissipates moisture fast once rainfall ends.,1,Rapid drying after rain; environmental dynamics only.
Multiple rain detections during stable high humidity indicate continuous or intermittent rainfall periods,High humidity fosters ongoing precipitation cycles.,1,Persistent rain cycles in moist air; weather-only signal.
Multiple rain detections during fluctuating humidity indicate unstable storm patterns,Humidity rising and falling while rain events occur suggests irregular or patchy storm activity.,1,Patchy/unstable storms; environmental only.
Rain detections occurring consistently at the same temperature ranges indicate climate-driven rainfall patterns,Certain temperatures may correlate with predictable rainfall events.,2,Temp-linked rain pattern implies local climate regime; minor site context.
Rain detections clustered at low temperatures suggest cold-season rainfall cycles,Rain occurs primarily during colder parts of the season.,2,Cold-season clustering hints climate/season; minor contextual exposure.
Rain detections clustered at high temperatures suggest warm-season or monsoon rainfall patterns,Rain primarily occurs when temperatures peak seasonally.,2,Warm-season/monsoon clustering hints locale/season; minor exposure.
Simultaneous temperature drop and humidity rise during rain detection indicates strong precipitation events,Heavy rainfall often cools air and increases atmospheric moisture rapidly.,1,Heavy rain signature; environmental only.
Rain detection followed by delayed humidity rise indicates slow atmospheric moisture integration,Humidity may lag behind rainfall when raindrops evaporate or when rainfall is sparse.,1,Humidity lag after rain; climate-only signal.
Rain detection followed by delayed temperature drop indicates insulated or heat-retaining environment,Ambient temperature changes slowly due to environmental buffering despite rainfall.,2,Thermal buffering slows cooling; reveals site exposure/insulation mildly.
Temperature stability during numerous rain detections suggests mild and steady rainfall conditions,Rain does not cause noticeable thermal fluctuations in stable climates.,1,Stable temps with rain; weather-only insight.
Humidity stability during rain detections suggests drizzle-like or evaporating rainfall,Humidity does not change significantly when rainfall is light or evaporates quickly.,1,Humidity unchanged with rain; light/evaporating rain signal only.
Temperature spikes between rain detections indicate drying cycles between intermittent rainfall,"Heat accumulates when rainfall pauses, increasing drying potential.",1,Heat between rains shows drying; environmental only.
Humidity drops between rain detections indicate rapid atmospheric clearing,"Moisture dissipates quickly between rain events, showing efficient atmospheric ventilation.",1,Atmosphere clears quickly; climate signal only.
Rain detections without notable temperature or humidity change suggest sensor-level rainfall or localized precipitation,Rain affects the sensor but does not alter broader environmental readings.,2,Localized/sensor-only rain implies microclimate/site context; minor exposure.
Rain detections with strong temperature or humidity changes across zones indicate widespread weather impact,Environmental readings confirm rainfall influence on a larger scale.,1,Broad weather impact across zones; climate-level insight only.
Rain detections concentrated during nighttime humidity peaks indicate nocturnal rainfall patterns,Night rain commonly aligns with maximum humidity and cooling.,2,Nighttime rain timing hints diurnal pattern/locale; minor contextual exposure.
Rain detections concentrated during daytime temperature peaks indicate convective storm behavior,Daytime heating fuels rapid storm formation leading to rain.,2,Daytime convective rain timing suggests climate pattern; minor context.
Humidity rising before temperature drops during rain detections indicates strong pre-rain moisture buildup,"Rain clouds form as humidity increases, eventually cooling the environment.",1,Moisture buildup then cooling; environmental only.
Temperature dropping before humidity rises during rain detections indicates cooling winds preceding precipitation,Atmospheric dynamics cause temperature drops before moisture accumulates.,1,Cooling winds precede moisture rise; weather-only signal.
