Inference,Description,score,short rationale
Quadruple-signal confirmation of active water incidents,"Simultaneous moisture rise, flow anomalies, temperature deviation, and device activation provide the strongest confirmation that an active water incident is occurring.",5,"Fully detailed incident with timing/location and activation; high reconstruction risk."
Distinguishing condensation from thermally driven leaks,Moisture rises at low temperatures without flow anomalies or device activation indicate condensation; matching flow anomalies and device activation confirm actual leaks.,3,"Separates condensation vs. leaks using signals; moderate sensitivity."
Detecting freeze-related seepage before rupture,"Sub-freezing temperatures followed by small flow anomalies, gradual moisture rise, and eventual device activation indicate freeze-induced seepage precursors to full rupture.",4,"Precursors to rupture with activation timing; incident-specific."
Classifying burst events vs. slow seepage,"High-magnitude flow anomalies with rapid moisture rise and activation indicate bursts, while small anomalies with slow moisture increases and activation delays reflect seepage.",4,"Severity/type classification with timing; strong reconstruction potential."
Detecting overheating-induced failures,"High temperatures combined with flow anomalies, moisture spikes, and device activation reveal leaks caused by overheating-related seal or pipe damage.",4,"Overheat-related incidents with activation logs; event-specific."
Identifying non-plumbing moisture sources,"Moisture rises at stable or cold temperatures with no flow anomalies or delayed/no device activation suggest humidity ingress, spills, or condensation instead of plumbing leaks.",3,"Distinguishes external moisture sources; moderate sensitivity."
Evaluating device response timing under thermal conditions,"If moisture and flow anomalies appear during extreme temperatures but device activation lags, the system is responding too slowly to thermally hazardous incidents.",3,"Operational timing gap; moderate incident detail."
Recognizing thermally masked leak signatures,"Cold temperatures dampen flow anomalies; when activation and moisture rise occur despite small flow anomalies, leaks are being masked by thermal effects.",4,"Shows masked leaks with activation evidence; incident-specific."
Thermally corrected severity estimation,"Combining flow anomaly magnitude, moisture slope, and temperature deviation yields a more accurate, temperature-aware severity score for water incidents.",4,"Per-incident severity with temperature context; detailed reconstruction."
Identifying micro-leaks through multi-signal subtlety,Small flow anomalies and slow moisture rises that trigger activation under extreme temperatures indicate thermally sensitive micro-leaks.,4,"Captures subtle leaks tied to temperature; location/timing sensitive."
Characterizing multi-stage failure sequences,Temperature drift → flow anomaly → moisture rise → device activation represents a multi-stage thermally influenced failure progression.,4,"Multi-stage timeline; strong incident fingerprint."
Distinguishing appliance discharge from actual leaks,Warm-temperature flow anomalies with no moisture rise but occasional device activation indicate appliance discharge; added moisture rise confirms structural leaks.,3,"Attributes events to appliances vs. leaks; some occupancy signal exposure."
Detecting drainage or backflow issues,Moisture rise without proportional flow anomalies but with device activation suggests drainage or backflow problems rather than supply-side leaks.,3,"Identifies drainage/backflow vs. supply; moderate sensitivity."
Identifying leaks in insulated or enclosed zones,Moisture rise and device activation with weak temperature deviation signal leaks behind insulation or walls where thermal signals are muted.,4,"Reveals hidden leak locations; high location specificity."
Evaluating device effectiveness via moisture decay and flow stabilization,"After device activation, fast moisture decay and flow normalization indicate effective mitigation; continued anomalies indicate incomplete control.",3,"Mitigation outcome per event; moderate exposure."
Predicting escalation from early anomaly clusters,"Before major leaks, small temperature deviations combined with minor flow anomalies and slight moisture rise may lead to activation, forming an early-warning precursor pattern.",4,"Precursor clustering with activation; supports forecasting."
Locating water ingress paths using gradient and timing,The zone with earliest moisture rise and strongest local temperature deviation during flow anomalies helps infer origin and path of water migration.,4,"Pinpoints origin/path via gradients and timing; location-sensitive."
Assessing insulation quality using temperature–moisture–flow correlation,Incidents occurring only during extreme temperatures with associated moisture and flow changes identify poorly insulated zones.,4,"Maps insulation gaps; location/history exposure."
Detecting intermittent thermally driven leaks,"Events that recur only during temperature extremes and generate flow anomalies, moisture spikes, and device activations indicate temperature-dependent intermittent leaks.",4,"Recurring temperature-bound leaks with activation logs; incident-specific."
Identifying cascading multi-zone failures,Flow anomalies in one zone triggering moisture rise and device activation across multiple areas signal cascading multi-zone water failures.,5,"Cascade across zones with activation order; high location/timeline sensitivity."
Triaging event severity using thermal-flow-moisture synergy,"Higher severity is indicated when temperature deviation, flow anomalies, and moisture spikes rise sharply and trigger rapid device activation.",4,"Severity triage per incident; detailed but technical."
Understanding moisture propagation under temperature effects,"Warm environments cause moisture to spread quickly despite small flow anomalies, while cold environments slow moisture propagation.",2,"Analytical behavior with low incident specificity."
Detecting false device activations,"Device activation without moisture rise, temperature deviation, or flow anomalies indicates false triggers from hardware or software faults.",2,"Flags false activations; low privacy impact."
Validating sensor alignment through four-signal consistency,"If moisture and temperature signals react but flow anomalies do not appear, flow sensors may be inaccurate; if flow reacts but moisture does not, moisture sensors may be misaligned.",2,"Sensor diagnostic; low personal exposure."
Predicting long-term system vulnerabilities,"Repeated four-signal events in the same temperature regimes reveal zones prone to long-term thermal and hydraulic stress, forecasting future failures.",4,"Zone-level vulnerability over time; location/history sensitive."
