Inference,Description,Score,Short rationale
Daily moisture cycle detection,Repeated rise and fall in moisture levels within a day reveals environmental humidity cycles or daily water-use patterns.,3,"Encodes daily humidity and water-use rhythms (e.g., morning/evening activity)."
Moisture accumulation rate,"The speed at which moisture levels increase indicates the intensity or strength of a leak, seepage source, or wetting event.",1,"Mainly intensity of leak/wetting; structural, not behavioral."
Moisture evaporation rate,"The speed at which moisture levels decrease reflects ventilation quality, ambient temperature, and material drying capacity.",2,Reflects ventilation/drying quality; mild link to how space is operated.
Persistent baseline elevation,"A consistently elevated moisture level suggests chronic humidity, long-standing dampness, or unresolved moisture intrusion.",2,Chronic damp/humidity; property condition more than individual behavior.
Intermittent moisture spikes,"Irregular sudden increases in moisture indicate episodic water exposure, such as spills, appliance discharge, or rainfall seepage.",2,"Episodic exposure (spills, appliance discharge, rainfall); weak behavior link."
Night–day moisture asymmetry,"Higher moisture levels at night imply reduced ventilation, lower temperatures, or nightly condensation formation on surfaces.",3,"Night vs day pattern can reflect occupancy, window/AC usage habits."
Seasonal moisture trend,Long-term logs showing higher moisture during specific months reflect seasonal humidity variations or monsoon-driven saturation.,2,Seasonal humidity/monsoon pattern; mostly climatic vulnerability.
Moisture saturation plateau,Moisture reaching a stable maximum level suggests that the surrounding material or environment is fully saturated.,1,Just indicates saturation of materials; no behavioral content.
Moisture rebound pattern after drying,Moisture returning after an apparent drying phase indicates trapped internal moisture or recurring intrusion sources.,1,Trapped moisture/recurring intrusion; structural.
Long-term drying inefficiency,"Very slow reduction of moisture levels over extended periods indicates poor drainage, limited airflow, or cold surfaces that hinder evaporation.",2,Poor drainage/airflow; property performance information.
Moisture gradient detection,Differences in moisture levels between nearby sensors show the direction and magnitude of moisture migration.,1,Direction/magnitude of moisture migration; physical only.
Horizontal moisture spread pattern,Sequential moisture increases among sensors on the same level infer lateral water movement across floors or walls.,1,Lateral spread across floors/walls; structural.
Vertical moisture spread pattern,"Higher moisture above versus below indicates rising damp, while higher moisture below indicates gravity-driven seepage from above.",1,Rising damp vs gravity seepage; physical phenomenon.
Material permeability indicator,Different rates of moisture increase across adjacent sensors reveal variations in absorption and permeability of local materials.,1,Absorption/permeability differences; material property.
Localized dampness hotspots,Sensors with chronically higher moisture values indicate structural damp zones or areas with poor sealing or insulation.,2,Persistent damp zones; could affect specific rooms/units.
Moisture containment boundary,Moisture increasing in one sensor but remaining low in neighbors suggests effective barriers preventing water spread.,1,Shows effectiveness of barriers; purely structural.
Hidden cavity saturation detection,Unexpectedly high moisture in isolated sensors suggests concealed voids or cavities where water accumulates.,2,Reveals concealed voids with water; asset-level sensitivity.
Cross-room moisture migration inference,Coordinated moisture changes across neighboring sensors indicate water traveling beneath floors or through partitions.,1,Water moving under floors/through partitions; structural path.
Capillary rise detection,Slow upward moisture increases in vertically arranged sensors indicate capillary action rather than direct leakage.,1,"Capillary action; physical, not behavioral."
Moisture insulation effectiveness,Low moisture readings next to high readings indicate that insulation or barriers are successfully limiting moisture transfer.,1,Insulation/barrier performance; non-personal.
Early-stage leak prediction,Slow but continuous moisture growth at a point suggests micro-seepage before a fully detectable leak occurs.,2,Micro-seepage prediction; property/maintenance info.
Intensity classification of damp events,"The rate and magnitude of moisture rise allow classification into minor seepage, moderate dampness, or severe wetting.",1,Classifying severity (minor/moderate/severe); no behavioral angle.
Water pooling indicator,Moisture levels that rise quickly and then remain high suggest pooling or standing water near the sensor.,1,Pooling/standing water presence; structural risk only.
Dry-spill differentiation,"Moisture that rises briefly and then rapidly falls indicates small, self-limited water exposure such as spills or splashes.",2,"Shows small, self-limited exposure (spills); mild behavior trace."
Chronic dampness signature,Stable medium moisture values over long durations signal persistent damp conditions without active flooding.,2,Persistent medium dampness; property hygiene/condition.
Humidity-condensation distinction,Gradual moisture rise without sharp peaks suggests condensation or airborne humidity rather than direct liquid contact.,1,Distinguishes condensation vs direct water; physical.
Porosity estimation,The speed and extent of moisture absorption into materials reveal their relative porosity and capacity to hold water.,1,Material porosity; non-personal.
Moisture shock events,"Sudden large moisture spikes indicate abrupt water contact events, such as pipe bursts or significant spills.",1,"Sudden large spikes (bursts/spills); event severity, not behavior."
Moisture retention capacity,The duration for which elevated moisture persists after a peak reveals how long the environment or material retains water.,1,How long materials hold water; physical property.
Flood-recession timing,The decay curve of moisture levels after sharp spikes reveals drainage performance and the time needed for conditions to normalize.,2,Drainage performance/timing; building vulnerability.
Ventilation efficiency estimation,"Faster drops in moisture after a wetting event imply effective ventilation, while slow drops imply stagnant air.",2,Airflow/ventilation quality; mild operational/usage signal.
Ambient humidity correlation,Moisture increases without clear wetting events suggest elevated ambient humidity affecting sensor surroundings.,1,Follows ambient humidity; environment-level only.
Condensation risk detection,Moisture levels that increase during cooler periods or at night indicate surface condensation risk.,1,"Risk of condensation; physical risk, not personal."
Temperature–moisture coupling pattern,Moisture changes that align with temperature shifts indicate dew point–driven moisture behavior.,1,Dew-point driven behavior; purely physical.
Climate vulnerability indicator,Recurring periods of high moisture in certain seasons indicate times when the environment is particularly prone to dampness.,2,Seasonal times of high dampness; building–climate sensitivity.
Surface temperature inference,Slow drying despite moderate humidity suggests cooler surfaces with reduced evaporation capacity.,1,Indicates cooler surfaces; no direct behavioral content.
Wind or airflow disruption detection,Minimal change in moisture levels despite expected environmental variations implies blocked or insufficient airflow.,2,Suggests blocked vents/airflow; mild link to how space is arranged/used.
Activity-linked moisture rise,"Moisture increases that align with typical activity times suggest links to human actions such as cleaning, showering, or cooking.",3,"Directly tied to human actions (showering, cooking, cleaning)."
System-usage pattern detection,Repeated moisture spikes that match appliance schedules reveal operational cycles of devices like washing machines or dishwashers.,3,Reflects appliance schedules (washers/dishwashers) and routine usage.
Watering or irrigation timing,Outdoor sensor moisture increases that correspond to recurring patterns indicate irrigation or watering schedules.,3,"Encodes irrigation schedule, linking to household outdoor routines."
Occupancy pattern inference,Changes in moisture drying rates between occupied and unoccupied periods allow indirect inference of occupancy cycles.,4,Explicitly infers occupied vs unoccupied periods; strong behavior/away pattern.
Unintentional water use detection,Unexpected moisture increases during low-activity or nighttime windows suggest accidental or unauthorized water use.,4,Detects possible accidental/unauthorized use at low-activity times; high profiling/security relevance.
Moisture suppression behavior,"Rapid moisture reduction during occupant presence implies manual cleanup, drying actions, or active mitigation.",3,Shows manual cleanup/mitigation during presence; moderate behavioral signal.
Moisture diffusion rate modeling,The shape of the moisture increase curve reveals diffusion characteristics of water moving through materials.,1,Diffusion characteristics in materials; physical only.
Absorption saturation threshold,"When the rate of moisture increase slows, the surrounding material is approaching or has reached its absorption limit.",1,Absorption limit of materials; non-personal.
Hydraulic pressure influence,Extremely rapid moisture rise suggests pressurized water intrusion rather than passive seepage or condensation.,1,Pressurized vs passive intrusion; infrastructure behavior.
Surface vs. subsurface water differentiation,"Steep, short-lived increases indicate surface water, while gradual, prolonged changes indicate subsurface seepage.",1,Differentiates surface vs subsurface; physical classification.
Contaminant or salinity effect inference,Unusually slow drying or persistently elevated moisture may indicate dissolved salts or contaminants that retain water.,2,"Suggests contaminants/salts; property condition, not behavior."
Moisture-related structural stress indicator,"Recurring extended high moisture conditions imply risk for mold growth, wood expansion, corrosion, or material degradation.",2,Long-term risk for mold/corrosion/expansion; property health.
Drainage gradient inference,Sensors that dry more slowly than others identify locations where drainage slope is insufficient or where water stagnates.,1,Identifies poor slope/stagnation zones; structural.
Water presence persistence mapping,The duration of elevated moisture at each sensor helps identify locations prone to long-term dampness.,2,"Long-duration damp spots; property condition, location-specific."
Material warping risk detection,"Rapid wetting combined with slow drying identifies conditions likely to cause swelling, warping, or finish damage in sensitive materials.",2,Risk for swelling/warping; asset-protection information.
Moisture anomaly detection,Moisture changes that deviate from typical patterns for a given environment indicate unusual events or sensor-area anomalies.,2,Detects unusual events; could hint at unexpected activities but weak identity link.
Reverse diffusion anomaly,Moisture decreasing in one sensor while increasing at another nearby suggests multi-layer or directional moisture transport.,1,Directional moisture transport oddities; physical system behavior.
Moisture rebound effect,"Moisture that rises again after an initial drying phase, without new water input, indicates trapped moisture redistributing within materials.",1,Trapped moisture redistribution; structural/physical.
Dampness migration resistance,Loss of correlation between neighboring sensors over time suggests varying resistance to moisture migration across the structure.,1,Resistance to moisture spread; material/structural property.
Hidden insulation failure,A sensor showing unexpectedly high moisture where insulation is expected suggests a breach or failure in the insulating layer.,2,Suggests insulation breach; property-level vulnerability.
Pipeline sweating indicator,"Slow, recurring moisture increases near expected pipe locations indicate condensation on cold pipelines rather than leaks.",2,"Indicates condensation on cold pipes; weak behavioral signal (e.g., heavy cold-water use)."
False-positive moisture signature,"Short-lived, low-level fluctuations around the threshold indicate possible condensation, misting, or sensor noise rather than true wetting.",1,Condensation/mist/sensor noise pattern; meta about sensor reliability.
Persistent micro-moisture film detection,Slight but sustained elevation of moisture levels indicates thin water films that may not pool but can support mold or mildew.,2,Thin films that can support mold; hygiene/health risk at property level.
Evaporation-limited region identification,Areas where moisture remains high for long durations reveal poorly ventilated or shaded recesses with limited evaporation.,2,Poorly ventilated/shaded recesses; property layout and risk zones.
Water ingress vs. steam exposure differentiation,"Sharp, large moisture rises indicate liquid ingress, while smaller, slower increases suggest steam or vapor exposure.",3,"Distinguishes leaks vs steam (e.g., showers); ties patterns more directly to human activity."
Moisture overshoot effect,Moisture rising beyond expected equilibrium levels suggests absorption into strongly hygroscopic materials reaching full saturation.,1,Hygroscopic material saturation behavior; physical only.